{
  "$schema": "https://json-schema.org/draft/2020-12/schema",
  "$id": "urn:pmplatform:schema:event-envelope:1",
  "title": "EventEnvelope",
  "description": "The one envelope every cross-module message carries (event-conventions.md EV-2). It is the serialised form of common.outbox_message.payload (ERD D-17). `data` is the event-specific body whose schema is named by eventType and schemaVersion.",
  "type": "object",
  "required": ["eventId", "eventType", "schemaVersion", "kind", "messageKey", "idempotencyKey", "occurredAt", "sourceModule", "correlationId", "causationId", "actor", "subject", "scope", "data"],
  "additionalProperties": false,
  "properties": {
    "eventId": { "type": "string", "format": "uuid", "description": "Generated by the producer; common.outbox_message.id" },
    "eventType": { "type": "string", "pattern": "^[A-Z][A-Za-z0-9]*\\.[A-Z][A-Za-z0-9]*$", "description": "<ProducerModule>.<EventName>, EventName in past tense for facts (EV-1)" },
    "schemaVersion": { "type": "integer", "minimum": 1, "description": "Version of the data schema for this eventType (EV-7)" },
    "kind": { "type": "string", "enum": ["DOMAIN_EVENT", "NOTIFICATION_INTENT", "AUDIT_EVENT"], "description": "common.outbox_message.message_type" },
    "messageKey": { "type": "string", "maxLength": 200, "description": "'<eventType>:<idempotencyKey>'; common.outbox_message.message_key, unique with kind (EV-4)" },
    "idempotencyKey": { "type": "string", "maxLength": 150, "description": "The producer's natural key for this occurrence (EV-4); never the HTTP Idempotency-Key and never the correlationId" },
    "occurredAt": { "type": "string", "format": "date-time", "description": "UTC, when the fact was committed by the producer" },
    "sourceModule": { "type": "string", "enum": ["Project", "Progress", "Schedule", "ProjectTask", "Milestone", "Risk", "ManagementConcern", "ChangeRequest", "Suspension", "Closure", "Approval", "DocumentManagement", "ExternalParticipation", "FinancialKpi", "Notifications", "Dashboards", "Reports", "IdentityAccess", "MasterDataConfig", "IntegrationMonitoring", "AuditActivity"] },
    "correlationId": { "type": "string", "format": "uuid", "description": "Carried from the originating request (api-conventions R-42)" },
    "causationId": { "type": ["string", "null"], "format": "uuid", "description": "eventId of the event whose handling produced this one; null when produced by a request" },
    "actor": {
      "type": "object",
      "required": ["actorType", "userId"],
      "additionalProperties": false,
      "properties": {
        "actorType": { "type": "string", "enum": ["USER", "SERVICE", "INTEGRATION"] },
        "userId": { "type": ["string", "null"], "format": "uuid", "description": "User.id, including service principals (ERD D-2); null only for INTEGRATION" }
      }
    },
    "subject": {
      "type": "object",
      "description": "The aggregate the event is about, as an opaque reference (M-4, D-15)",
      "required": ["module", "type", "id", "revisionNo"],
      "additionalProperties": false,
      "properties": {
        "module": { "type": "string" },
        "type": { "type": "string", "description": "ERD entity name (PascalCase)" },
        "id": { "type": "string", "format": "uuid" },
        "revisionNo": { "type": ["integer", "null"], "minimum": 1, "description": "Present for every revisioned aggregate (D-15); consumers reject a stale revision" }
      }
    },
    "scope": {
      "type": "object",
      "description": "Authorization and routing anchors supplied by the producer (M-7)",
      "required": ["projectId", "departmentId", "externalEntityId"],
      "additionalProperties": false,
      "properties": {
        "projectId": { "type": ["string", "null"], "format": "uuid" },
        "departmentId": { "type": ["string", "null"], "format": "uuid" },
        "externalEntityId": { "type": ["string", "null"], "format": "uuid" }
      }
    },
    "data": { "type": "object", "description": "Event-specific body; schema '<eventType>.v<schemaVersion>' (EV-3). Identifiers and facts only, never a sensitive value, never a full aggregate." }
  }
}
