{
  "eventId": "0c8f3b2e-4a6d-4e1f-9b7a-2d5c8e1f4a6b",
  "eventType": "Project.ProjectIntakeRecorded",
  "schemaVersion": 1,
  "kind": "DOMAIN_EVENT",
  "messageKey": "Project.ProjectIntakeRecorded:5e2a7c91-3b4d-4f6e-8a1b-9c0d2e3f4a5b",
  "idempotencyKey": "5e2a7c91-3b4d-4f6e-8a1b-9c0d2e3f4a5b",
  "occurredAt": "2026-09-20T09:12:44Z",
  "sourceModule": "Project",
  "correlationId": "1f2e3d4c-5b6a-4798-8a9b-0c1d2e3f4a5b",
  "causationId": null,
  "actor": { "actorType": "USER", "userId": "9e8d7c6b-5a4f-4e3d-8c2b-1a0f9e8d7c6b" },
  "subject": { "module": "Project", "type": "ProjectIntake", "id": "5e2a7c91-3b4d-4f6e-8a1b-9c0d2e3f4a5b", "revisionNo": null },
  "scope": { "projectId": "7c9e6679-7425-40de-944b-e07fc1f90ae7", "departmentId": "3a0b6f4c-1e2d-4f5a-8b6c-7d8e9f0a1b2c", "externalEntityId": null },
  "data": {
    "projectId": "7c9e6679-7425-40de-944b-e07fc1f90ae7",
    "projectIntakeId": "5e2a7c91-3b4d-4f6e-8a1b-9c0d2e3f4a5b",
    "legacyIntakeDate": "2026-09-20",
    "declaredBaseline": { "budgetSar": "12500000.00", "endDate": "2028-06-30" },
    "openingPosition": {
      "percentComplete": 35.0,
      "spendToDateSar": "4100000.00",
      "achievedMilestones": [
        { "projectMilestoneId": "d1e2f3a4-b5c6-4d7e-8f9a-0b1c2d3e4f5a", "actualAchievementDate": "2026-03-31" }
      ]
    }
  }
}
