{
  "eventId": "f0e1d2c3-b4a5-4968-8776-5a4b3c2d1e0f",
  "eventType": "ManagementConcern.ConcernEscalated",
  "schemaVersion": 1,
  "kind": "NOTIFICATION_INTENT",
  "messageKey": "ManagementConcern.ConcernEscalated:9a8b7c6d-5e4f-4a3b-8c2d-1e0f9a8b7c6d",
  "idempotencyKey": "9a8b7c6d-5e4f-4a3b-8c2d-1e0f9a8b7c6d",
  "occurredAt": "2026-09-22T07:45:00Z",
  "sourceModule": "ManagementConcern",
  "correlationId": "c1b2a3d4-e5f6-4a7b-8c9d-0e1f2a3b4c5d",
  "causationId": null,
  "actor": { "actorType": "USER", "userId": "9e8d7c6b-5a4f-4e3d-8c2b-1a0f9e8d7c6b" },
  "subject": { "module": "ManagementConcern", "type": "ManagementConcern", "id": "4d5e6f7a-8b9c-4d0e-9f1a-2b3c4d5e6f7a", "revisionNo": 1 },
  "scope": { "projectId": "7c9e6679-7425-40de-944b-e07fc1f90ae7", "departmentId": "3a0b6f4c-1e2d-4f5a-8b6c-7d8e9f0a1b2c", "externalEntityId": null },
  "data": {
    "eventFamilyCode": "CONCERN_ESCALATION",
    "sourceReference": "9a8b7c6d-5e4f-4a3b-8c2d-1e0f9a8b7c6d",
    "scheduledFor": null,
    "deepLink": "/projects/7c9e6679-7425-40de-944b-e07fc1f90ae7/issues-challenges/4d5e6f7a-8b9c-4d0e-9f1a-2b3c4d5e6f7a",
    "parameters": [
      { "name": "concernType", "value": "ISSUE" },
      { "name": "escalationNo", "value": "1" },
      { "name": "escalatedToRoleCode", "value": "R03" },
      { "name": "severity", "value": "MAJOR" }
    ],
    "condition": null
  }
}
